[
  {
    "id": "sfx_plant",
    "kind": "sfx",
    "phase": "P0",
    "targetMaxDurationMs": 400,
    "loop": false,
    "status": "planned",
    "relativeFile": null,
    "promptPath": "asset_prompts/21_AUDIO/SFX_PACK.md",
    "sourceTool": null,
    "rightsNote": "Chưa sinh; kiểm điều khoản công cụ khi tạo.",
    "sha256": null,
    "measuredDurationMs": null
  },
  {
    "id": "sfx_water",
    "kind": "sfx",
    "phase": "P0",
    "targetMaxDurationMs": 800,
    "loop": false,
    "status": "planned",
    "relativeFile": null,
    "promptPath": "asset_prompts/21_AUDIO/SFX_PACK.md",
    "sourceTool": null,
    "rightsNote": "Chưa sinh; kiểm điều khoản công cụ khi tạo.",
    "sha256": null,
    "measuredDurationMs": null
  },
  {
    "id": "sfx_harvest",
    "kind": "sfx",
    "phase": "P0",
    "targetMaxDurationMs": 500,
    "loop": false,
    "status": "planned",
    "relativeFile": null,
    "promptPath": "asset_prompts/21_AUDIO/SFX_PACK.md",
    "sourceTool": null,
    "rightsNote": "Chưa sinh; kiểm điều khoản công cụ khi tạo.",
    "sha256": null,
    "measuredDurationMs": null
  },
  {
    "id": "sfx_coin",
    "kind": "sfx",
    "phase": "P0",
    "targetMaxDurationMs": 400,
    "loop": false,
    "status": "planned",
    "relativeFile": null,
    "promptPath": "asset_prompts/21_AUDIO/SFX_PACK.md",
    "sourceTool": null,
    "rightsNote": "Chưa sinh; kiểm điều khoản công cụ khi tạo.",
    "sha256": null,
    "measuredDurationMs": null
  },
  {
    "id": "sfx_repair",
    "kind": "sfx",
    "phase": "P0",
    "targetMaxDurationMs": 1500,
    "loop": false,
    "status": "planned",
    "relativeFile": null,
    "promptPath": "asset_prompts/21_AUDIO/SFX_PACK.md",
    "sourceTool": null,
    "rightsNote": "Chưa sinh; kiểm điều khoản công cụ khi tạo.",
    "sha256": null,
    "measuredDurationMs": null
  },
  {
    "id": "sfx_puzzle_success",
    "kind": "sfx",
    "phase": "P0",
    "targetMaxDurationMs": 1200,
    "loop": false,
    "status": "planned",
    "relativeFile": null,
    "promptPath": "asset_prompts/21_AUDIO/SFX_PACK.md",
    "sourceTool": null,
    "rightsNote": "Chưa sinh; kiểm điều khoản công cụ khi tạo.",
    "sha256": null,
    "measuredDurationMs": null
  },
  {
    "id": "sfx_ui_tap",
    "kind": "sfx",
    "phase": "P0",
    "targetMaxDurationMs": 150,
    "loop": false,
    "status": "planned",
    "relativeFile": null,
    "promptPath": "asset_prompts/21_AUDIO/SFX_PACK.md",
    "sourceTool": null,
    "rightsNote": "Chưa sinh; kiểm điều khoản công cụ khi tạo.",
    "sha256": null,
    "measuredDurationMs": null
  },
  {
    "id": "sfx_ui_error",
    "kind": "sfx",
    "phase": "P0",
    "targetMaxDurationMs": 300,
    "loop": false,
    "status": "planned",
    "relativeFile": null,
    "promptPath": "asset_prompts/21_AUDIO/SFX_PACK.md",
    "sourceTool": null,
    "rightsNote": "Chưa sinh; kiểm điều khoản công cụ khi tạo.",
    "sha256": null,
    "measuredDurationMs": null
  },
  {
    "id": "sfx_momo",
    "kind": "sfx",
    "phase": "P0",
    "targetMaxDurationMs": 1000,
    "loop": false,
    "status": "planned",
    "relativeFile": null,
    "promptPath": "asset_prompts/21_AUDIO/SFX_PACK.md",
    "sourceTool": null,
    "rightsNote": "Chưa sinh; kiểm điều khoản công cụ khi tạo.",
    "sha256": null,
    "measuredDurationMs": null
  },
  {
    "id": "sfx_page",
    "kind": "sfx",
    "phase": "P1",
    "targetMaxDurationMs": 400,
    "loop": false,
    "status": "planned",
    "relativeFile": null,
    "promptPath": "asset_prompts/21_AUDIO/SFX_PACK.md",
    "sourceTool": null,
    "rightsNote": "Chưa sinh; kiểm điều khoản công cụ khi tạo.",
    "sha256": null,
    "measuredDurationMs": null
  },
  {
    "id": "music_garden_day",
    "kind": "music",
    "phase": "P0",
    "targetMaxDurationMs": 90000,
    "loop": true,
    "status": "planned",
    "relativeFile": null,
    "promptPath": "asset_prompts/21_AUDIO/GARDEN_MUSIC.md",
    "sourceTool": null,
    "rightsNote": "Chưa sinh; kiểm điều khoản công cụ khi tạo.",
    "sha256": null,
    "measuredDurationMs": null
  },
  {
    "id": "music_garden_night",
    "kind": "music",
    "phase": "P1",
    "targetMaxDurationMs": 90000,
    "loop": true,
    "status": "planned",
    "relativeFile": null,
    "promptPath": "asset_prompts/21_AUDIO/GARDEN_MUSIC.md",
    "sourceTool": null,
    "rightsNote": "Chưa sinh; kiểm điều khoản công cụ khi tạo.",
    "sha256": null,
    "measuredDurationMs": null
  },
  {
    "id": "music_puzzle",
    "kind": "music",
    "phase": "P0",
    "targetMaxDurationMs": 60000,
    "loop": true,
    "status": "planned",
    "relativeFile": null,
    "promptPath": "asset_prompts/21_AUDIO/GARDEN_MUSIC.md",
    "sourceTool": null,
    "rightsNote": "Chưa sinh; kiểm điều khoản công cụ khi tạo.",
    "sha256": null,
    "measuredDurationMs": null
  },
  {
    "id": "ambience_rain",
    "kind": "ambience",
    "phase": "P1",
    "targetMaxDurationMs": 60000,
    "loop": true,
    "status": "planned",
    "relativeFile": null,
    "promptPath": "asset_prompts/21_AUDIO/AUDIO_MASTER_PROMPT.md",
    "sourceTool": null,
    "rightsNote": "Chưa sinh; kiểm điều khoản công cụ khi tạo.",
    "sha256": null,
    "measuredDurationMs": null
  }
]
